{
  "schema_version": "sat-sim.object-scope.v1",
  "catalog_version": "workbench-catalog.v2",
  "scope_status": "frozen_engineering_scope",
  "claim_boundary": "Internal engineering simulation, training and evaluation only; not real hardware or flight validation.",
  "expected_counts": {"component": 24, "subsystem": 6, "whole_spacecraft": 1, "total": 31},
  "objects": [
    {"object_id": "whole_spacecraft", "level": "whole_spacecraft", "domain": "whole_spacecraft", "name_zh": "整星数字样机", "primary_capability_id": "whole_spacecraft.unified_native.v1", "candidate_capability_ids": []},
    {"object_id": "subsystem.adcs", "level": "subsystem", "domain": "adcs", "name_zh": "姿态与轨道控制", "primary_capability_id": "subsystem.adcs_unified_native.v1", "candidate_capability_ids": []},
    {"object_id": "subsystem.propulsion", "level": "subsystem", "domain": "propulsion", "name_zh": "推进", "primary_capability_id": "subsystem.propulsion.unified_native.v1", "candidate_capability_ids": []},
    {"object_id": "subsystem.eps", "level": "subsystem", "domain": "eps", "name_zh": "电源", "primary_capability_id": "subsystem.eps.unified_native.v1", "candidate_capability_ids": []},
    {"object_id": "subsystem.thermal", "level": "subsystem", "domain": "thermal", "name_zh": "热控", "primary_capability_id": "subsystem.thermal.basic_lumped.v1", "candidate_capability_ids": []},
    {"object_id": "subsystem.payload", "level": "subsystem", "domain": "payload", "name_zh": "载荷", "primary_capability_id": "subsystem.payload.source_native.v1", "candidate_capability_ids": []},
    {"object_id": "subsystem.comm_data", "level": "subsystem", "domain": "comm_data", "name_zh": "通信与数据管理", "primary_capability_id": "subsystem.comm_data.unified_native.v1", "candidate_capability_ids": []},
    {"object_id": "component.antenna", "level": "component", "domain": "comm_data", "name_zh": "天线", "primary_capability_id": "component.antenna.v1", "candidate_capability_ids": []},
    {"object_id": "component.battery", "level": "component", "domain": "eps", "name_zh": "蓄电池", "primary_capability_id": "component.battery.v1", "candidate_capability_ids": []},
    {"object_id": "component.cmg", "level": "component", "domain": "adcs", "name_zh": "控制力矩陀螺", "primary_capability_id": "component.cmg.v1", "candidate_capability_ids": []},
    {"object_id": "component.data_queue", "level": "component", "domain": "comm_data", "name_zh": "数据队列", "primary_capability_id": "component.data_queue.v1", "candidate_capability_ids": []},
    {"object_id": "component.fuel_tank", "level": "component", "domain": "propulsion", "name_zh": "燃料贮箱", "primary_capability_id": "component.fuel_tank.v1", "candidate_capability_ids": []},
    {"object_id": "component.ground_station", "level": "component", "domain": "comm_data", "name_zh": "地面站", "primary_capability_id": "component.ground_station.v1", "candidate_capability_ids": []},
    {"object_id": "component.heater", "level": "component", "domain": "thermal", "name_zh": "加热器", "primary_capability_id": "component.heater.v1", "candidate_capability_ids": []},
    {"object_id": "component.imu", "level": "component", "domain": "adcs", "name_zh": "惯性测量单元", "primary_capability_id": "component.imu.v1", "candidate_capability_ids": []},
    {"object_id": "component.link_budget", "level": "component", "domain": "comm_data", "name_zh": "链路预算", "primary_capability_id": "component.link_budget.v1", "candidate_capability_ids": []},
    {"object_id": "component.magnetometer", "level": "component", "domain": "adcs", "name_zh": "磁强计", "primary_capability_id": "component.magnetometer.v1", "candidate_capability_ids": []},
    {"object_id": "component.mtb", "level": "component", "domain": "adcs", "name_zh": "磁力矩器", "primary_capability_id": "component.mtb.v1", "candidate_capability_ids": []},
    {"object_id": "component.onboard_storage", "level": "component", "domain": "comm_data", "name_zh": "星上存储", "primary_capability_id": "component.onboard_storage.v1", "candidate_capability_ids": []},
    {"object_id": "component.payload", "level": "component", "domain": "payload", "name_zh": "载荷仪器", "primary_capability_id": "component.payload.v1", "candidate_capability_ids": []},
    {"object_id": "component.payload_sensor", "level": "component", "domain": "payload", "name_zh": "载荷传感器", "primary_capability_id": "component.payload_sensor.v1", "candidate_capability_ids": []},
    {"object_id": "component.pdu", "level": "component", "domain": "eps", "name_zh": "配电单元", "primary_capability_id": "component.pdu.v1", "candidate_capability_ids": []},
    {"object_id": "component.power_sink", "level": "component", "domain": "eps", "name_zh": "功率负载", "primary_capability_id": "component.power_sink.v1", "candidate_capability_ids": []},
    {"object_id": "component.radiator", "level": "component", "domain": "thermal", "name_zh": "散热器", "primary_capability_id": "component.radiator.v1", "candidate_capability_ids": []},
    {"object_id": "component.reaction_wheel", "level": "component", "domain": "adcs", "name_zh": "反作用轮", "primary_capability_id": "component.reaction_wheel.v1", "candidate_capability_ids": []},
    {"object_id": "component.solar_panel", "level": "component", "domain": "eps", "name_zh": "太阳电池阵", "primary_capability_id": "component.solar_panel.v1", "candidate_capability_ids": []},
    {"object_id": "component.star_tracker", "level": "component", "domain": "adcs", "name_zh": "星敏感器", "primary_capability_id": "component.star_tracker.v1", "candidate_capability_ids": []},
    {"object_id": "component.sun_sensor", "level": "component", "domain": "adcs", "name_zh": "太阳敏感器", "primary_capability_id": "component.sun_sensor.v1", "candidate_capability_ids": []},
    {"object_id": "component.thermal_node", "level": "component", "domain": "thermal", "name_zh": "热节点", "primary_capability_id": "component.thermal_node.v1", "candidate_capability_ids": []},
    {"object_id": "component.thruster", "level": "component", "domain": "propulsion", "name_zh": "推力器", "primary_capability_id": "component.thruster.v1", "candidate_capability_ids": []},
    {"object_id": "component.transmitter", "level": "component", "domain": "comm_data", "name_zh": "发射机", "primary_capability_id": "component.transmitter.v1", "candidate_capability_ids": []}
  ]
}
